<?xml version="1.0" encoding="UTF-8"?>
<!DOCTYPE specification-instance SYSTEM "specification-configuration-1.0.dtd">
<specification-instance>
	<request>
		<head>
			<request-type>SIN101</request-type>
			<version>1.0</version>
		</head>
		<content>
	<!-- 	个人会员同步 -->
			<property-field id="merchNo" type="an" name="merchNo" nullable="false" length="15"/>
			<property-field id="sessionId" type="an" name="sessionId" nullable="false" length="16"/>
			<property-field id="entranceMemId" type="an" name="entranceMemId" nullable="false" length="32"/>
			<property-field id="phone" type="n" name="phone" nullable="false" length="11"/>
			<property-field id="email" type="ans" name="email" nullable="true" length="32" optional="true"/>
			<property-field id="name" type="ans" name="name" nullable="false" length="32"/>
			<property-field id="loginName" type="ans" name="loginName" nullable="false" length="32"/>
			<property-field id="loginPwd" type="ans" name="loginPwd" nullable="false" length="256"/>
			<property-field id="gender" type="a" name="gender" nullable="false"  length="1"/>
			<property-field id="mac" type="ans" name="mac" nullable="false" length="256"/>
		</content>
	</request>
	<response>
		<content>
			<property-field id="merchNo" type="an" name="merchNo" nullable="false" length="15"/>
			<property-field id="sessionId" type="an" name="sessionId" nullable="false" length="16"/>
			<property-field id="rescode" type="an" name="rescode" nullable="false" length="2"/>
			<property-field id="resdes" type="ans" name="resdes" nullable="false" length="128"/>
			<property-field id="memberId" type="an" name="merchId" nullable="false" length="15"/>
		    <property-field id="mac" type="ans" name="mac" nullable="false"  length="256"/>
		</content>
	</response>
</specification-instance>