<?xml version="1.0" encoding="UTF-8"?>
<!DOCTYPE specification-instance SYSTEM "specification-configuration-1.0.dtd">
<specification-instance>
	<request>
		<head>
			<request-type>SPA101</request-type>
			<version>1.0</version>
		</head>
		<content>
		<!-- 账户收支明细查询-->
			<property-field id="merchNo" type="an" name="merchNo" nullable="false"  length="15"/>
			<property-field id="sessionId" type="an" name="sessionId" nullable="false"  length="16"/>
			<property-field id="bankName" type="ans" name="bankName" nullable="false" length="128"/>
			<property-field id="mac" type="ans" name="mac" nullable="false"  length="256"/>
			
		</content>
	</request>
	<response>
		<content>
			<property-field id="merchNo" type="an" name="merchNo" nullable="false"  length="15"/>
			<property-field id="sessionId" type="an" name="sessionId" nullable="false" length="16"/>
			<property-field id="rescode" type="an" name="rescode" nullable="false" length="2"/>
			<property-field id="resdes" type="ans" name="resdes" nullable="false" length="128"/>
			<list-field id="bankInfos" name="bankInfos">
				<ref value="bankInfo"></ref>
			</list-field>
			<complex-field id="bankInfo" name="bankInfo"
				typeClass="com.zlebank.zplatform.specification.message.content.BankInfo">
				<property-field name="bankNode" id="bankNode" type="an" length="12"/>
				<property-field name="acctName" id="acctName" type="an" length="12"/>
				<property-field name="bankName" id="bankName" type="ans" length="64"/>
				<property-field name="bankAdress" id="bankAdress" type="ans" length="64"/>
			</complex-field>
			<property-field id="mac" type="ans" name="mac" nullable="false"  length="256"/>

		</content>
	</response>
</specification-instance>