<?xml version="1.0" encoding="UTF-8"?>
<!DOCTYPE specification-instance SYSTEM "specification-configuration-1.0.dtd">
<specification-instance>
	<request>
		<head>
			<request-type>AIN103</request-type>
			<version>1.0</version>
		</head>
		<content>
		<!-- 个人会员同步通知 -->
			<property-field id="merchNo" type="an" name="merchNo" nullable="false"></property-field>
			<property-field id="srcSessionId" type="an" name="srcSessionId" nullable="false"></property-field>
			<property-field id="memberId" type="an" name="memberId" nullable="false"></property-field>
			<property-field id="status" type="an" name="status" nullable="false"></property-field>		
			<property-field id="mac" type="ans" name="mac" nullable="false"></property-field>		
		</content>
	</request>
	<response>
		<content>			
			<property-field id="merchNo" type="an" name="merchNo" nullable="false"></property-field>
			<property-field id="srcSessionId" type="an" name="sessionId" nullable="false"></property-field>
			<property-field id="rescode" type="an" name="rescode" nullable="false"></property-field>
			<property-field id="resdes" type="ans" name="resdes" nullable="false" optional="true" ></property-field>
			<property-field id="mac" type="ans" name="mac" nullable="false"></property-field>
		</content>
	</response>
</specification-instance>